Sheet: lang
A1: old key | B1: new key | C1: group | D1: final key | E1: cz value | F1: en value | G1: orig | H1: "
B2: language-name-in-english | E2: Czech | F2: English
B3: language-name-in-original-language | E3: čeština | F3: English
A4: 1 | B4: message | D4: of:=[.A4] -> 1 | E4: Požadavek | F4: Message | G4: of:=[.A4] -> 1 | H4: of:=COM.MICROSOFT.CONCAT([.$H$1];[.D4];[.$H$1]) -> "1" | I4: of:=COM.MICROSOFT.CONCAT([.$H$1];[.F4];[.$H$1]) -> "Message" | J4: of:=COM.MICROSOFT.CONCAT("map.put(";[.H4];",";[.I4];");") -> map.put("1","Message");
A5: 2 | B5: alert | D5: common.alert | E5: Varování | F5: Alert | G5: of:=[.A5] -> 2 | H5: of:=COM.MICROSOFT.CONCAT([.$H$1];[.D5];[.$H$1]) -> "common.alert" | I5: of:=COM.MICROSOFT.CONCAT([.$H$1];[.F5];[.$H$1]) -> "Alert" | J5: of:=COM.MICROSOFT.CONCAT("map.put(";[.H5];",";[.I5];");") -> map.put("common.alert","Alert");
A6: 3 | B6: request | D6: of:=[.A6] -> 3 | E6: Požadavek | F6: Request | G6: of:=[.A6] -> 3 | H6: of:=COM.MICROSOFT.CONCAT([.$H$1];[.D6];[.$H$1]) -> "3" | I6: of:=COM.MICROSOFT.CONCAT([.$H$1];[.F6];[.$H$1]) -> "Request" | J6: of:=COM.MICROSOFT.CONCAT("map.put(";[.H6];",";[.I6];");") -> map.put("3","Request");
A7: 50 | B7: colour | D7: of:=[.A7] -> 50 | E7: Barva | F7: Colour | G7: of:=[.A7] -> 50 | H7: of:=COM.MICROSOFT.CONCAT([.$H$1];[.D7];[.$H$1]) -> "50" | I7: of:=COM.MICROSOFT.CONCAT([.$H$1];[.F7];[.$H$1]) -> "Colour" | J7: of:=COM.MICROSOFT.CONCAT("map.put(";[.H7];",";[.I7];");") -> map.put("50","Colour");
A8: 51 | B8: light-green | D8: of:=[.A8] -> 51 | E8: Světle zelená | F8: Light green | G8: of:=[.A8] -> 51 | H8: of:=COM.MICROSOFT.CONCAT([.$H$1];[.D8];[.$H$1]) -> "51" | I8: of:=COM.MICROSOFT.CONCAT([.$H$1];[.F8];[.$H$1]) -> "Light green" | J8: of:=COM.MICROSOFT.CONCAT("map.put(";[.H8];",";[.I8];");") -> map.put("51","Light green");
A9: 52 | B9: red | D9: of:=[.A9] -> 52 | E9: Červená | F9: Red | G9: of:=[.A9] -> 52 | H9: of:=COM.MICROSOFT.CONCAT([.$H$1];[.D9];[.$H$1]) -> "52" | I9: of:=COM.MICROSOFT.CONCAT([.$H$1];[.F9];[.$H$1]) -> "Red" | J9: of:=COM.MICROSOFT.CONCAT("map.put(";[.H9];",";[.I9];");") -> map.put("52","Red");
A10: 53 | B10: dark-blue | D10: of:=[.A10] -> 53 | E10: Tmavě modrá | F10: Dark blue | G10: of:=[.A10] -> 53 | H10: of:=COM.MICROSOFT.CONCAT([.$H$1];[.D10];[.$H$1]) -> "53" | I10: of:=COM.MICROSOFT.CONCAT([.$H$1];[.F10];[.$H$1]) -> "Dark blue" | J10: of:=COM.MICROSOFT.CONCAT("map.put(";[.H10];",";[.I10];");") -> map.put("53","Dark blue");
A11: 54 | B11: yellow | D11: of:=[.A11] -> 54 | E11: Žlutá | F11: Yellow | G11: of:=[.A11] -> 54 | H11: of:=COM.MICROSOFT.CONCAT([.$H$1];[.D11];[.$H$1]) -> "54" | I11: of:=COM.MICROSOFT.CONCAT([.$H$1];[.F11];[.$H$1]) -> "Yellow" | J11: of:=COM.MICROSOFT.CONCAT("map.put(";[.H11];",";[.I11];");") -> map.put("54","Yellow");
A12: 55 | B12: light-blue | D12: of:=[.A12] -> 55 | E12: Světle modrá | F12: Light blue | G12: of:=[.A12] -> 55 | H12: of:=COM.MICROSOFT.CONCAT([.$H$1];[.D12];[.$H$1]) -> "55" | I12: of:=COM.MICROSOFT.CONCAT([.$H$1];[.F12];[.$H$1]) -> "Light blue" | J12: of:=COM.MICROSOFT.CONCAT("map.put(";[.H12];",";[.I12];");") -> map.put("55","Light blue");
A13: 56 | B13: purple | D13: of:=[.A13] -> 56 | E13: Fialová | F13: Purple | G13: of:=[.A13] -> 56 | H13: of:=COM.MICROSOFT.CONCAT([.$H$1];[.D13];[.$H$1]) -> "56" | I13: of:=COM.MICROSOFT.CONCAT([.$H$1];[.F13];[.$H$1]) -> "Purple" | J13: of:=COM.MICROSOFT.CONCAT("map.put(";[.H13];",";[.I13];");") -> map.put("56","Purple");
A14: 57 | B14: brown | D14: of:=[.A14] -> 57 | E14: Hnědá | F14: Brown | G14: of:=[.A14] -> 57 | H14: of:=COM.MICROSOFT.CONCAT([.$H$1];[.D14];[.$H$1]) -> "57" | I14: of:=COM.MICROSOFT.CONCAT([.$H$1];[.F14];[.$H$1]) -> "Brown" | J14: of:=COM.MICROSOFT.CONCAT("map.put(";[.H14];",";[.I14];");") -> map.put("57","Brown");
A15: 58 | B15: pink | D15: of:=[.A15] -> 58 | E15: Růžová | F15: Pink | G15: of:=[.A15] -> 58 | H15: of:=COM.MICROSOFT.CONCAT([.$H$1];[.D15];[.$H$1]) -> "58" | I15: of:=COM.MICROSOFT.CONCAT([.$H$1];[.F15];[.$H$1]) -> "Pink" | J15: of:=COM.MICROSOFT.CONCAT("map.put(";[.H15];",";[.I15];");") -> map.put("58","Pink");
A16: 59 | B16: green | D16: of:=[.A16] -> 59 | E16: Zelená | F16: Green | G16: of:=[.A16] -> 59 | H16: of:=COM.MICROSOFT.CONCAT([.$H$1];[.D16];[.$H$1]) -> "59" | I16: of:=COM.MICROSOFT.CONCAT([.$H$1];[.F16];[.$H$1]) -> "Green" | J16: of:=COM.MICROSOFT.CONCAT("map.put(";[.H16];",";[.I16];");") -> map.put("59","Green");
A17: 60 | B17: gold | D17: of:=[.A17] -> 60 | E17: Zlatá | F17: Gold | G17: of:=[.A17] -> 60 | H17: of:=COM.MICROSOFT.CONCAT([.$H$1];[.D17];[.$H$1]) -> "60" | I17: of:=COM.MICROSOFT.CONCAT([.$H$1];[.F17];[.$H$1]) -> "Gold" | J17: of:=COM.MICROSOFT.CONCAT("map.put(";[.H17];",";[.I17];");") -> map.put("60","Gold");
A18: 61 | B18: orange | D18: of:=[.A18] -> 61 | E18: Oranžová | F18: Orange | G18: of:=[.A18] -> 61 | H18: of:=COM.MICROSOFT.CONCAT([.$H$1];[.D18];[.$H$1]) -> "61" | I18: of:=COM.MICROSOFT.CONCAT([.$H$1];[.F18];[.$H$1]) -> "Orange" | J18: of:=COM.MICROSOFT.CONCAT("map.put(";[.H18];",";[.I18];");") -> map.put("61","Orange");
A19: 62 | B19: white | D19: of:=[.A19] -> 62 | E19: Bílá | F19: White | G19: of:=[.A19] -> 62 | H19: of:=COM.MICROSOFT.CONCAT([.$H$1];[.D19];[.$H$1]) -> "62" | I19: of:=COM.MICROSOFT.CONCAT([.$H$1];[.F19];[.$H$1]) -> "White" | J19: of:=COM.MICROSOFT.CONCAT("map.put(";[.H19];",";[.I19];");") -> map.put("62","White");
A20: 63 | B20: grey | D20: of:=[.A20] -> 63 | E20: Šedivá | F20: Grey | G20: of:=[.A20] -> 63 | H20: of:=COM.MICROSOFT.CONCAT([.$H$1];[.D20];[.$H$1]) -> "63" | I20: of:=COM.MICROSOFT.CONCAT([.$H$1];[.F20];[.$H$1]) -> "Grey" | J20: of:=COM.MICROSOFT.CONCAT("map.put(";[.H20];",";[.I20];");") -> map.put("63","Grey");
A21: 64 | B21: black | D21: of:=[.A21] -> 64 | E21: Černá | F21: Black | G21: of:=[.A21] -> 64 | H21: of:=COM.MICROSOFT.CONCAT([.$H$1];[.D21];[.$H$1]) -> "64" | I21: of:=COM.MICROSOFT.CONCAT([.$H$1];[.F21];[.$H$1]) -> "Black" | J21: of:=COM.MICROSOFT.CONCAT("map.put(";[.H21];",";[.I21];");") -> map.put("64","Black");
A22: 65 | B22: blue | D22: of:=[.A22] -> 65 | E22: Modrá | F22: Blue | G22: of:=[.A22] -> 65 | H22: of:=COM.MICROSOFT.CONCAT([.$H$1];[.D22];[.$H$1]) -> "65" | I22: of:=COM.MICROSOFT.CONCAT([.$H$1];[.F22];[.$H$1]) -> "Blue" | J22: of:=COM.MICROSOFT.CONCAT("map.put(";[.H22];",";[.I22];");") -> map.put("65","Blue");
A23: 66 | B23: army-green | D23: of:=[.A23] -> 66 | E23: Vojenská zelená | F23: Army green | G23: of:=[.A23] -> 66 | H23: of:=COM.MICROSOFT.CONCAT([.$H$1];[.D23];[.$H$1]) -> "66" | I23: of:=COM.MICROSOFT.CONCAT([.$H$1];[.F23];[.$H$1]) -> "Army green" | J23: of:=COM.MICROSOFT.CONCAT("map.put(";[.H23];",";[.I23];");") -> map.put("66","Army green");
A24: 101 | D24: loginwindow.login | E24: Přihlášení | F24: Login | G24: of:=[.A24] -> 101 | H24: of:=COM.MICROSOFT.CONCAT([.$H$1];[.D24];[.$H$1]) -> "loginwindow.login" | I24: of:=COM.MICROSOFT.CONCAT([.$H$1];[.F24];[.$H$1]) -> "Login" | J24: of:=COM.MICROSOFT.CONCAT("map.put(";[.H24];",";[.I24];");") -> map.put("loginwindow.login","Login");
A25: 111 | D25: common.nick | E25: Přezdívka | F25: Nick | G25: of:=[.A25] -> 111 | H25: of:=COM.MICROSOFT.CONCAT([.$H$1];[.D25];[.$H$1]) -> "common.nick" | I25: of:=COM.MICROSOFT.CONCAT([.$H$1];[.F25];[.$H$1]) -> "Nick" | J25: of:=COM.MICROSOFT.CONCAT("map.put(";[.H25];",";[.I25];");") -> map.put("common.nick","Nick");
A26: 112 | B26: password | D26: common.password | E26: Heslo | F26: Password | G26: of:=[.A26] -> 112 | H26: of:=COM.MICROSOFT.CONCAT([.$H$1];[.D26];[.$H$1]) -> "common.password" | I26: of:=COM.MICROSOFT.CONCAT([.$H$1];[.F26];[.$H$1]) -> "Password" | J26: of:=COM.MICROSOFT.CONCAT("map.put(";[.H26];",";[.I26];");") -> map.put("common.password","Password");
A27: 121 | B27: keep-me-signed-in | D27: loginwindow.keep-me-logged | E27: Neodhlašovat | F27: Keep me logged | G27: of:=[.A27] -> 121 | H27: of:=COM.MICROSOFT.CONCAT([.$H$1];[.D27];[.$H$1]) -> "loginwindow.keep-me-logged" | I27: of:=COM.MICROSOFT.CONCAT([.$H$1];[.F27];[.$H$1]) -> "Keep me logged" | J27: of:=COM.MICROSOFT.CONCAT("map.put(";[.H27];",";[.I27];");") -> map.put("loginwindow.keep-me-logged","Keep me logged");
A28: 131 | B28: sign-in | D28: of:=COM.MICROSOFT.CONCAT("loginwindow.";[.B28]) -> loginwindow.sign-in | E28: Přihlásit se | F28: Sign in | G28: of:=[.A28] -> 131 | H28: of:=COM.MICROSOFT.CONCAT([.$H$1];[.D28];[.$H$1]) -> "loginwindow.sign-in" | I28: of:=COM.MICROSOFT.CONCAT([.$H$1];[.F28];[.$H$1]) -> "Sign in" | J28: of:=COM.MICROSOFT.CONCAT("map.put(";[.H28];",";[.I28];");") -> map.put("loginwindow.sign-in","Sign in");
A29: 132 | B29: view-help | D29: of:=COM.MICROSOFT.CONCAT("loginwindow.";[.B29]) -> loginwindow.view-help | E29: Zobrazit nápovědu | F29: View help | G29: of:=[.A29] -> 132 | H29: of:=COM.MICROSOFT.CONCAT([.$H$1];[.D29];[.$H$1]) -> "loginwindow.view-help" | I29: of:=COM.MICROSOFT.CONCAT([.$H$1];[.F29];[.$H$1]) -> "View help" | J29: of:=COM.MICROSOFT.CONCAT("map.put(";[.H29];",";[.I29];");") -> map.put("loginwindow.view-help","View help");
A30: 133 | B30: create-new-player | D30: of:=COM.MICROSOFT.CONCAT("common.";[.B30]) -> common.create-new-player | E30: Vytvořit nového hráče | F30: Create new player | G30: of:=[.A30] -> 133 | H30: of:=COM.MICROSOFT.CONCAT([.$H$1];[.D30];[.$H$1]) -> "common.create-new-player" | I30: of:=COM.MICROSOFT.CONCAT([.$H$1];[.F30];[.$H$1]) -> "Create new player" | J30: of:=COM.MICROSOFT.CONCAT("map.put(";[.H30];",";[.I30];");") -> map.put("common.create-new-player","Create new player");
A31: 151 | B31: invalid-nick-or-password | D31: of:=COM.MICROSOFT.CONCAT("loginwindow.";[.B31]) -> loginwindow.invalid-nick-or-password | E31: Nesprávná přezdívka nebo heslo | F31: Invalid nick or password | G31: of:=[.A31] -> 151 | H31: of:=COM.MICROSOFT.CONCAT([.$H$1];[.D31];[.$H$1]) -> "loginwindow.invalid-nick-or-password" | I31: of:=COM.MICROSOFT.CONCAT([.$H$1];[.F31];[.$H$1]) -> "Invalid nick or password" | J31: of:=COM.MICROSOFT.CONCAT("map.put(";[.H31];",";[.I31];");") -> map.put("loginwindow.invalid-nick-or-password","Invalid nick or password");
A32: 201 | B32: creating-new-player | D32: of:=[.A32] -> 201 | E32: Vytváření nového hráče | F32: Creating new player | G32: of:=[.A32] -> 201 | H32: of:=COM.MICROSOFT.CONCAT([.$H$1];[.D32];[.$H$1]) -> "201" | I32: of:=COM.MICROSOFT.CONCAT([.$H$1];[.F32];[.$H$1]) -> "Creating new player" | J32: of:=COM.MICROSOFT.CONCAT("map.put(";[.H32];",";[.I32];");") -> map.put("201","Creating new player");
A33: 211 | B33: display-language | D33: of:=[.A33] -> 211 | E33: Jazyk zobrazení | F33: Display language | G33: of:=[.A33] -> 211 | H33: of:=COM.MICROSOFT.CONCAT([.$H$1];[.D33];[.$H$1]) -> "211" | I33: of:=COM.MICROSOFT.CONCAT([.$H$1];[.F33];[.$H$1]) -> "Display language" | J33: of:=COM.MICROSOFT.CONCAT("map.put(";[.H33];",";[.I33];");") -> map.put("211","Display language");
A34: 214 | B34: confirm-password | D34: of:=[.A34] -> 214 | E34: Potvrďte heslo | F34: Confirm password | G34: of:=[.A34] -> 214 | H34: of:=COM.MICROSOFT.CONCAT([.$H$1];[.D34];[.$H$1]) -> "214" | I34: of:=COM.MICROSOFT.CONCAT([.$H$1];[.F34];[.$H$1]) -> "Confirm password" | J34: of:=COM.MICROSOFT.CONCAT("map.put(";[.H34];",";[.I34];");") -> map.put("214","Confirm password");
A35: 221 | B35: password-is-not-mandatory. | D35: of:=[.A35] -> 221 | E35: Heslo není povinné. | F35: Password is not mandatory. | G35: of:=[.A35] -> 221 | H35: of:=COM.MICROSOFT.CONCAT([.$H$1];[.D35];[.$H$1]) -> "221" | I35: of:=COM.MICROSOFT.CONCAT([.$H$1];[.F35];[.$H$1]) -> "Password is not mandatory." | J35: of:=COM.MICROSOFT.CONCAT("map.put(";[.H35];",";[.I35];");") -> map.put("221","Password is not mandatory.");
A36: 222 | B36: if-you-want-to-no-password,-let-password-cell-empty. | D36: of:=[.A36] -> 222 | E36: Pokud nechcete heslo, nechte pole heslo prázdné. | F36: If you want to no password, let password cell empty. | G36: of:=[.A36] -> 222 | H36: of:=COM.MICROSOFT.CONCAT([.$H$1];[.D36];[.$H$1]) -> "222" | I36: of:=COM.MICROSOFT.CONCAT([.$H$1];[.F36];[.$H$1]) -> "If you want to no password, let password cell empty." | J36: of:=COM.MICROSOFT.CONCAT("map.put(";[.H36];",";[.I36];");") -> map.put("222","If you want to no password, let password cell empty.");
A37: 223 | B37: nick-and-password-can-contain-only-a-z,a-z-and-0-9-chars. | D37: of:=[.A37] -> 223 | E37: Přezdívka a heslo mohou obsahovat pouze znaky a-z, A-Z a 0-9. | F37: Nick and password can contain only a-z,A-Z and 0-9 chars. | G37: of:=[.A37] -> 223 | H37: of:=COM.MICROSOFT.CONCAT([.$H$1];[.D37];[.$H$1]) -> "223" | I37: of:=COM.MICROSOFT.CONCAT([.$H$1];[.F37];[.$H$1]) -> "Nick and password can contain only a-z,A-Z and 0-9 chars." | J37: of:=COM.MICROSOFT.CONCAT("map.put(";[.H37];",";[.I37];");") -> map.put("223","Nick and password can contain only a-z,A-Z and 0-9 chars.");
A38: 224 | B38: nick-and-password-maximum-lenght-can-be-16-chars | D38: of:=[.A38] -> 224 | E38: Přezdívka a heslo mohou mít maximální délku 16 znaků. | F38: Nick and password maximum lenght can be 16 chars | G38: of:=[.A38] -> 224 | H38: of:=COM.MICROSOFT.CONCAT([.$H$1];[.D38];[.$H$1]) -> "224" | I38: of:=COM.MICROSOFT.CONCAT([.$H$1];[.F38];[.$H$1]) -> "Nick and password maximum lenght can be 16 chars" | J38: of:=COM.MICROSOFT.CONCAT("map.put(";[.H38];",";[.I38];");") -> map.put("224","Nick and password maximum lenght can be 16 chars");
A39: 231 | B39: colour-skin | D39: of:=[.A39] -> 231 | E39: Barevné téma | F39: Colour skin | G39: of:=[.A39] -> 231 | H39: of:=COM.MICROSOFT.CONCAT([.$H$1];[.D39];[.$H$1]) -> "231" | I39: of:=COM.MICROSOFT.CONCAT([.$H$1];[.F39];[.$H$1]) -> "Colour skin" | J39: of:=COM.MICROSOFT.CONCAT("map.put(";[.H39];",";[.I39];");") -> map.put("231","Colour skin");
A40: 241 | B40: too-long-nick. | D40: of:=[.A40] -> 241 | E40: Příliš dlouhá přezdívka. | F40: Too long nick. | G40: of:=[.A40] -> 241 | H40: of:=COM.MICROSOFT.CONCAT([.$H$1];[.D40];[.$H$1]) -> "241" | I40: of:=COM.MICROSOFT.CONCAT([.$H$1];[.F40];[.$H$1]) -> "Too long nick." | J40: of:=COM.MICROSOFT.CONCAT("map.put(";[.H40];",";[.I40];");") -> map.put("241","Too long nick.");
A41: 242 | B41: too-long-password. | D41: of:=[.A41] -> 242 | E41: Příliš dlouhé heslo. | F41: Too long password. | G41: of:=[.A41] -> 242 | H41: of:=COM.MICROSOFT.CONCAT([.$H$1];[.D41];[.$H$1]) -> "242" | I41: of:=COM.MICROSOFT.CONCAT([.$H$1];[.F41];[.$H$1]) -> "Too long password." | J41: of:=COM.MICROSOFT.CONCAT("map.put(";[.H41];",";[.I41];");") -> map.put("242","Too long password.");
A42: 243 | B42: nick-cell-is-empty. | D42: of:=[.A42] -> 243 | E42: Pole přezdívka je prázdné. | F42: Nick cell is empty. | G42: of:=[.A42] -> 243 | H42: of:=COM.MICROSOFT.CONCAT([.$H$1];[.D42];[.$H$1]) -> "243" | I42: of:=COM.MICROSOFT.CONCAT([.$H$1];[.F42];[.$H$1]) -> "Nick cell is empty." | J42: of:=COM.MICROSOFT.CONCAT("map.put(";[.H42];",";[.I42];");") -> map.put("243","Nick cell is empty.");
A43: 244 | B43: nick-already-exists. | D43: of:=[.A43] -> 244 | E43: Přezdívka již existuje. | F43: Nick already exists. | G43: of:=[.A43] -> 244 | H43: of:=COM.MICROSOFT.CONCAT([.$H$1];[.D43];[.$H$1]) -> "244" | I43: of:=COM.MICROSOFT.CONCAT([.$H$1];[.F43];[.$H$1]) -> "Nick already exists." | J43: of:=COM.MICROSOFT.CONCAT("map.put(";[.H43];",";[.I43];");") -> map.put("244","Nick already exists.");
A44: 245 | B44: password-and-confirm-password-do-not-match. | D44: of:=[.A44] -> 245 | E44: Heslo a potvrzovací heslo nesouhlasí. | F44: Password and Confirm password do not match. | G44: of:=[.A44] -> 245 | H44: of:=COM.MICROSOFT.CONCAT([.$H$1];[.D44];[.$H$1]) -> "245" | I44: of:=COM.MICROSOFT.CONCAT([.$H$1];[.F44];[.$H$1]) -> "Password and Confirm password do not match." | J44: of:=COM.MICROSOFT.CONCAT("map.put(";[.H44];",";[.I44];");") -> map.put("245","Password and Confirm password do not match.");
A45: 1001 | B45: game | D45: of:=[.A45] -> 1001 | E45: Hra | F45: Game | G45: of:=[.A45] -> 1001 | H45: of:=COM.MICROSOFT.CONCAT([.$H$1];[.D45];[.$H$1]) -> "1001" | I45: of:=COM.MICROSOFT.CONCAT([.$H$1];[.F45];[.$H$1]) -> "Game" | J45: of:=COM.MICROSOFT.CONCAT("map.put(";[.H45];",";[.I45];");") -> map.put("1001","Game");
A46: 1002 | B46: welcome,-new-player.-press-f1-to-see-help.-good-luck. | D46: of:=[.A46] -> 1002 | E46: Vítejte, nový hráči. Zmačkněte F1 pro nápovědu. Hodně štěstí. | F46: Welcome, new player. Press F1 to see Help. Good luck. | G46: of:=[.A46] -> 1002 | H46: of:=COM.MICROSOFT.CONCAT([.$H$1];[.D46];[.$H$1]) -> "1002" | I46: of:=COM.MICROSOFT.CONCAT([.$H$1];[.F46];[.$H$1]) -> "Welcome, new player. Press F1 to see Help. Good luck." | J46: of:=COM.MICROSOFT.CONCAT("map.put(";[.H46];",";[.I46];");") -> map.put("1002","Welcome, new player. Press F1 to see Help. Good luck.");
A47: 1003 | B47: are-you-sure-to-log-out? | D47: of:=[.A47] -> 1003 | E47: Vážne se chcete odhlásit? | F47: Are you sure to log out? | G47: of:=[.A47] -> 1003 | H47: of:=COM.MICROSOFT.CONCAT([.$H$1];[.D47];[.$H$1]) -> "1003" | I47: of:=COM.MICROSOFT.CONCAT([.$H$1];[.F47];[.$H$1]) -> "Are you sure to log out?" | J47: of:=COM.MICROSOFT.CONCAT("map.put(";[.H47];",";[.I47];");") -> map.put("1003","Are you sure to log out?");
A48: 1004 | B48: are-you-sure-to-exit? | D48: of:=[.A48] -> 1004 | E48: Vážně chcete skončit? | F48: Are you sure to exit? | G48: of:=[.A48] -> 1004 | H48: of:=COM.MICROSOFT.CONCAT([.$H$1];[.D48];[.$H$1]) -> "1004" | I48: of:=COM.MICROSOFT.CONCAT([.$H$1];[.F48];[.$H$1]) -> "Are you sure to exit?" | J48: of:=COM.MICROSOFT.CONCAT("map.put(";[.H48];",";[.I48];");") -> map.put("1004","Are you sure to exit?");
A49: 1011 | B49: new-with-current-composition | D49: of:=[.A49] -> 1011 | E49: Nová se současným sestavením | F49: New with current composition | G49: of:=[.A49] -> 1011 | H49: of:=COM.MICROSOFT.CONCAT([.$H$1];[.D49];[.$H$1]) -> "1011" | I49: of:=COM.MICROSOFT.CONCAT([.$H$1];[.F49];[.$H$1]) -> "New with current composition" | J49: of:=COM.MICROSOFT.CONCAT("map.put(";[.H49];",";[.I49];");") -> map.put("1011","New with current composition");
A50: 1012 | B50: new-with-custom-composition | D50: of:=[.A50] -> 1012 | E50: Nová s vlastním sestavením | F50: New with custom composition | G50: of:=[.A50] -> 1012 | H50: of:=COM.MICROSOFT.CONCAT([.$H$1];[.D50];[.$H$1]) -> "1012" | I50: of:=COM.MICROSOFT.CONCAT([.$H$1];[.F50];[.$H$1]) -> "New with custom composition" | J50: of:=COM.MICROSOFT.CONCAT("map.put(";[.H50];",";[.I50];");") -> map.put("1012","New with custom composition");
A51: 1013 | B51: save | D51: of:=[.A51] -> 1013 | E51: Uložit | F51: Save | G51: of:=[.A51] -> 1013 | H51: of:=COM.MICROSOFT.CONCAT([.$H$1];[.D51];[.$H$1]) -> "1013" | I51: of:=COM.MICROSOFT.CONCAT([.$H$1];[.F51];[.$H$1]) -> "Save" | J51: of:=COM.MICROSOFT.CONCAT("map.put(";[.H51];",";[.I51];");") -> map.put("1013","Save");
A52: 1014 | B52: load | D52: of:=[.A52] -> 1014 | E52: Nahrát | F52: Load | G52: of:=[.A52] -> 1014 | H52: of:=COM.MICROSOFT.CONCAT([.$H$1];[.D52];[.$H$1]) -> "1014" | I52: of:=COM.MICROSOFT.CONCAT([.$H$1];[.F52];[.$H$1]) -> "Load" | J52: of:=COM.MICROSOFT.CONCAT("map.put(";[.H52];",";[.I52];");") -> map.put("1014","Load");
A53: 1021 | B53: log-out | D53: of:=[.A53] -> 1021 | E53: Odhlásit se | F53: Log out | G53: of:=[.A53] -> 1021 | H53: of:=COM.MICROSOFT.CONCAT([.$H$1];[.D53];[.$H$1]) -> "1021" | I53: of:=COM.MICROSOFT.CONCAT([.$H$1];[.F53];[.$H$1]) -> "Log out" | J53: of:=COM.MICROSOFT.CONCAT("map.put(";[.H53];",";[.I53];");") -> map.put("1021","Log out");
A54: 1022 | B54: exit | D54: of:=[.A54] -> 1022 | E54: Ukončit | F54: Exit | G54: of:=[.A54] -> 1022 | H54: of:=COM.MICROSOFT.CONCAT([.$H$1];[.D54];[.$H$1]) -> "1022" | I54: of:=COM.MICROSOFT.CONCAT([.$H$1];[.F54];[.$H$1]) -> "Exit" | J54: of:=COM.MICROSOFT.CONCAT("map.put(";[.H54];",";[.I54];");") -> map.put("1022","Exit");
A55: 1101 | B55: options | D55: of:=[.A55] -> 1101 | E55: Možnosti | F55: Options | G55: of:=[.A55] -> 1101 | H55: of:=COM.MICROSOFT.CONCAT([.$H$1];[.D55];[.$H$1]) -> "1101" | I55: of:=COM.MICROSOFT.CONCAT([.$H$1];[.F55];[.$H$1]) -> "Options" | J55: of:=COM.MICROSOFT.CONCAT("map.put(";[.H55];",";[.I55];");") -> map.put("1101","Options");
A56: 1111 | B56: results | D56: of:=[.A56] -> 1111 | E56: Výsledky | F56: Results | G56: of:=[.A56] -> 1111 | H56: of:=COM.MICROSOFT.CONCAT([.$H$1];[.D56];[.$H$1]) -> "1111" | I56: of:=COM.MICROSOFT.CONCAT([.$H$1];[.F56];[.$H$1]) -> "Results" | J56: of:=COM.MICROSOFT.CONCAT("map.put(";[.H56];",";[.I56];");") -> map.put("1111","Results");
A57: 1112 | B57: information-about-current-game | D57: of:=[.A57] -> 1112 | E57: Informace o aktuální hře | F57: Information about current game | G57: of:=[.A57] -> 1112 | H57: of:=COM.MICROSOFT.CONCAT([.$H$1];[.D57];[.$H$1]) -> "1112" | I57: of:=COM.MICROSOFT.CONCAT([.$H$1];[.F57];[.$H$1]) -> "Information about current game" | J57: of:=COM.MICROSOFT.CONCAT("map.put(";[.H57];",";[.I57];");") -> map.put("1112","Information about current game");
A58: 1113 | B58: show-next-balls | D58: of:=[.A58] -> 1113 | E58: Ukázat další míče | F58: Show next balls | G58: of:=[.A58] -> 1113 | H58: of:=COM.MICROSOFT.CONCAT([.$H$1];[.D58];[.$H$1]) -> "1113" | I58: of:=COM.MICROSOFT.CONCAT([.$H$1];[.F58];[.$H$1]) -> "Show next balls" | J58: of:=COM.MICROSOFT.CONCAT("map.put(";[.H58];",";[.I58];");") -> map.put("1113","Show next balls");
A59: 1114 | B59: hide-next-balls | D59: of:=[.A59] -> 1114 | E59: Skrýt další míče | F59: Hide next balls | G59: of:=[.A59] -> 1114 | H59: of:=COM.MICROSOFT.CONCAT([.$H$1];[.D59];[.$H$1]) -> "1114" | I59: of:=COM.MICROSOFT.CONCAT([.$H$1];[.F59];[.$H$1]) -> "Hide next balls" | J59: of:=COM.MICROSOFT.CONCAT("map.put(";[.H59];",";[.I59];");") -> map.put("1114","Hide next balls");
A60: 1115 | B60: player-settings | D60: of:=[.A60] -> 1115 | E60: Nastavení hráče | F60: Player settings | G60: of:=[.A60] -> 1115 | H60: of:=COM.MICROSOFT.CONCAT([.$H$1];[.D60];[.$H$1]) -> "1115" | I60: of:=COM.MICROSOFT.CONCAT([.$H$1];[.F60];[.$H$1]) -> "Player settings" | J60: of:=COM.MICROSOFT.CONCAT("map.put(";[.H60];",";[.I60];");") -> map.put("1115","Player settings");
A61: 1121 | B61: switch-to-fullscreen-mode | D61: of:=[.A61] -> 1121 | E61: Přepnout do režimu celé obrazovky | F61: Switch to Fullscreen mode | G61: of:=[.A61] -> 1121 | H61: of:=COM.MICROSOFT.CONCAT([.$H$1];[.D61];[.$H$1]) -> "1121" | I61: of:=COM.MICROSOFT.CONCAT([.$H$1];[.F61];[.$H$1]) -> "Switch to Fullscreen mode" | J61: of:=COM.MICROSOFT.CONCAT("map.put(";[.H61];",";[.I61];");") -> map.put("1121","Switch to Fullscreen mode");
A62: 1122 | B62: switch-to-window-mode | D62: of:=[.A62] -> 1122 | E62: Přepnout do režimu oken | F62: Switch to Window mode | G62: of:=[.A62] -> 1122 | H62: of:=COM.MICROSOFT.CONCAT([.$H$1];[.D62];[.$H$1]) -> "1122" | I62: of:=COM.MICROSOFT.CONCAT([.$H$1];[.F62];[.$H$1]) -> "Switch to Window mode" | J62: of:=COM.MICROSOFT.CONCAT("map.put(";[.H62];",";[.I62];");") -> map.put("1122","Switch to Window mode");
A63: 1201 | B63: help | D63: of:=[.A63] -> 1201 | E63: Pomoc | F63: Help | G63: of:=[.A63] -> 1201 | H63: of:=COM.MICROSOFT.CONCAT([.$H$1];[.D63];[.$H$1]) -> "1201" | I63: of:=COM.MICROSOFT.CONCAT([.$H$1];[.F63];[.$H$1]) -> "Help" | J63: of:=COM.MICROSOFT.CONCAT("map.put(";[.H63];",";[.I63];");") -> map.put("1201","Help");
A64: 1211 | B64: about-this-game | D64: of:=[.A64] -> 1211 | E64: O této hře | F64: About this game | G64: of:=[.A64] -> 1211 | H64: of:=COM.MICROSOFT.CONCAT([.$H$1];[.D64];[.$H$1]) -> "1211" | I64: of:=COM.MICROSOFT.CONCAT([.$H$1];[.F64];[.$H$1]) -> "About this game" | J64: of:=COM.MICROSOFT.CONCAT("map.put(";[.H64];",";[.I64];");") -> map.put("1211","About this game");
A65: 10001 | B65: signing | D65: of:=[.A65] -> 10001 | E65: Přihlášení | F65: Signing | G65: of:=[.A65] -> 10001 | H65: of:=COM.MICROSOFT.CONCAT([.$H$1];[.D65];[.$H$1]) -> "10001" | I65: of:=COM.MICROSOFT.CONCAT([.$H$1];[.F65];[.$H$1]) -> "Signing" | J65: of:=COM.MICROSOFT.CONCAT("map.put(";[.H65];",";[.I65];");") -> map.put("10001","Signing");
A66: 10013 | B66: update-player-nick | D66: of:=[.A66] -> 10013 | E66: Aktualizovat přezdívku hráče | F66: Update player nick | G66: of:=[.A66] -> 10013 | H66: of:=COM.MICROSOFT.CONCAT([.$H$1];[.D66];[.$H$1]) -> "10013" | I66: of:=COM.MICROSOFT.CONCAT([.$H$1];[.F66];[.$H$1]) -> "Update player nick" | J66: of:=COM.MICROSOFT.CONCAT("map.put(";[.H66];",";[.I66];");") -> map.put("10013","Update player nick");
A67: 10021 | B67: old-password | D67: of:=[.A67] -> 10021 | E67: Staré heslo | F67: Old password | G67: of:=[.A67] -> 10021 | H67: of:=COM.MICROSOFT.CONCAT([.$H$1];[.D67];[.$H$1]) -> "10021" | I67: of:=COM.MICROSOFT.CONCAT([.$H$1];[.F67];[.$H$1]) -> "Old password" | J67: of:=COM.MICROSOFT.CONCAT("map.put(";[.H67];",";[.I67];");") -> map.put("10021","Old password");
A68: 10022 | B68: new-password | D68: of:=[.A68] -> 10022 | E68: Nové heslo | F68: New password | G68: of:=[.A68] -> 10022 | H68: of:=COM.MICROSOFT.CONCAT([.$H$1];[.D68];[.$H$1]) -> "10022" | I68: of:=COM.MICROSOFT.CONCAT([.$H$1];[.F68];[.$H$1]) -> "New password" | J68: of:=COM.MICROSOFT.CONCAT("map.put(";[.H68];",";[.I68];");") -> map.put("10022","New password");
A69: 10023 | B69: confirm-new-password | D69: of:=[.A69] -> 10023 | E69: Potvrďte nové heslo | F69: Confirm new password | G69: of:=[.A69] -> 10023 | H69: of:=COM.MICROSOFT.CONCAT([.$H$1];[.D69];[.$H$1]) -> "10023" | I69: of:=COM.MICROSOFT.CONCAT([.$H$1];[.F69];[.$H$1]) -> "Confirm new password" | J69: of:=COM.MICROSOFT.CONCAT("map.put(";[.H69];",";[.I69];");") -> map.put("10023","Confirm new password");
A70: 10024 | B70: update-password | D70: of:=[.A70] -> 10024 | E70: Aktualizovat heslo | F70: Update password | G70: of:=[.A70] -> 10024 | H70: of:=COM.MICROSOFT.CONCAT([.$H$1];[.D70];[.$H$1]) -> "10024" | I70: of:=COM.MICROSOFT.CONCAT([.$H$1];[.F70];[.$H$1]) -> "Update password" | J70: of:=COM.MICROSOFT.CONCAT("map.put(";[.H70];",";[.I70];");") -> map.put("10024","Update password");
A71: 10101 | B71: look | D71: of:=[.A71] -> 10101 | E71: Vzhled | F71: Look | G71: of:=[.A71] -> 10101 | H71: of:=COM.MICROSOFT.CONCAT([.$H$1];[.D71];[.$H$1]) -> "10101" | I71: of:=COM.MICROSOFT.CONCAT([.$H$1];[.F71];[.$H$1]) -> "Look" | J71: of:=COM.MICROSOFT.CONCAT("map.put(";[.H71];",";[.I71];");") -> map.put("10101","Look");
A72: 10102 | B72: zoom | D72: of:=[.A72] -> 10102 | E72: Přiblížení | F72: Zoom | G72: of:=[.A72] -> 10102 | H72: of:=COM.MICROSOFT.CONCAT([.$H$1];[.D72];[.$H$1]) -> "10102" | I72: of:=COM.MICROSOFT.CONCAT([.$H$1];[.F72];[.$H$1]) -> "Zoom" | J72: of:=COM.MICROSOFT.CONCAT("map.put(";[.H72];",";[.I72];");") -> map.put("10102","Zoom");
A73: 10113 | B73: ball-lighting | D73: of:=[.A73] -> 10113 | E73: Osvětlení míče | F73: Ball lighting | G73: of:=[.A73] -> 10113 | H73: of:=COM.MICROSOFT.CONCAT([.$H$1];[.D73];[.$H$1]) -> "10113" | I73: of:=COM.MICROSOFT.CONCAT([.$H$1];[.F73];[.$H$1]) -> "Ball lighting" | J73: of:=COM.MICROSOFT.CONCAT("map.put(";[.H73];",";[.I73];");") -> map.put("10113","Ball lighting");
A74: 10114 | B74: none | D74: of:=[.A74] -> 10114 | E74: Žádné | F74: None | G74: of:=[.A74] -> 10114 | H74: of:=COM.MICROSOFT.CONCAT([.$H$1];[.D74];[.$H$1]) -> "10114" | I74: of:=COM.MICROSOFT.CONCAT([.$H$1];[.F74];[.$H$1]) -> "None" | J74: of:=COM.MICROSOFT.CONCAT("map.put(";[.H74];",";[.I74];");") -> map.put("10114","None");
A75: 10115 | B75: from-above | D75: of:=[.A75] -> 10115 | E75: Shora | F75: From above | G75: of:=[.A75] -> 10115 | H75: of:=COM.MICROSOFT.CONCAT([.$H$1];[.D75];[.$H$1]) -> "10115" | I75: of:=COM.MICROSOFT.CONCAT([.$H$1];[.F75];[.$H$1]) -> "From above" | J75: of:=COM.MICROSOFT.CONCAT("map.put(";[.H75];",";[.I75];");") -> map.put("10115","From above");
A76: 10116 | B76: from-the-side | D76: of:=[.A76] -> 10116 | E76: Z boku | F76: From the side | G76: of:=[.A76] -> 10116 | H76: of:=COM.MICROSOFT.CONCAT([.$H$1];[.D76];[.$H$1]) -> "10116" | I76: of:=COM.MICROSOFT.CONCAT([.$H$1];[.F76];[.$H$1]) -> "From the side" | J76: of:=COM.MICROSOFT.CONCAT("map.put(";[.H76];",";[.I76];");") -> map.put("10116","From the side");
A77: 10121 | B77: show-line-around-ball | D77: of:=[.A77] -> 10121 | E77: Ukázat čáru kolem míče | F77: Show line around ball | G77: of:=[.A77] -> 10121 | H77: of:=COM.MICROSOFT.CONCAT([.$H$1];[.D77];[.$H$1]) -> "10121" | I77: of:=COM.MICROSOFT.CONCAT([.$H$1];[.F77];[.$H$1]) -> "Show line around ball" | J77: of:=COM.MICROSOFT.CONCAT("map.put(";[.H77];",";[.I77];");") -> map.put("10121","Show line around ball");
A78: 10122 | B78: show,-where-a-ball-can-be-moved | D78: of:=[.A78] -> 10122 | E78: Ukázat, kde může být míč přesunut | F78: Show, where a ball can be moved | G78: of:=[.A78] -> 10122 | H78: of:=COM.MICROSOFT.CONCAT([.$H$1];[.D78];[.$H$1]) -> "10122" | I78: of:=COM.MICROSOFT.CONCAT([.$H$1];[.F78];[.$H$1]) -> "Show, where a ball can be moved" | J78: of:=COM.MICROSOFT.CONCAT("map.put(";[.H78];",";[.I78];");") -> map.put("10122","Show, where a ball can be moved");
A79: 10123 | B79: highlight-cells-after-ball-exploded | D79: of:=[.A79] -> 10123 | E79: Zvýraznit pole po explozi míčů | F79: Highlight cells after ball exploded | G79: of:=[.A79] -> 10123 | H79: of:=COM.MICROSOFT.CONCAT([.$H$1];[.D79];[.$H$1]) -> "10123" | I79: of:=COM.MICROSOFT.CONCAT([.$H$1];[.F79];[.$H$1]) -> "Highlight cells after ball exploded" | J79: of:=COM.MICROSOFT.CONCAT("map.put(";[.H79];",";[.I79];");") -> map.put("10123","Highlight cells after ball exploded");
A80: 10124 | B80: ball-move-effect | D80: of:=[.A80] -> 10124 | E80: Efekt přesunu míče | F80: Ball move effect | G80: of:=[.A80] -> 10124 | H80: of:=COM.MICROSOFT.CONCAT([.$H$1];[.D80];[.$H$1]) -> "10124" | I80: of:=COM.MICROSOFT.CONCAT([.$H$1];[.F80];[.$H$1]) -> "Ball move effect" | J80: of:=COM.MICROSOFT.CONCAT("map.put(";[.H80];",";[.I80];");") -> map.put("10124","Ball move effect");
A81: 10125 | B81: no-extra-effect | D81: of:=[.A81] -> 10125 | E81: Žádný navíc | F81: No extra effect | G81: of:=[.A81] -> 10125 | H81: of:=COM.MICROSOFT.CONCAT([.$H$1];[.D81];[.$H$1]) -> "10125" | I81: of:=COM.MICROSOFT.CONCAT([.$H$1];[.F81];[.$H$1]) -> "No extra effect" | J81: of:=COM.MICROSOFT.CONCAT("map.put(";[.H81];",";[.I81];");") -> map.put("10125","No extra effect");
A82: 10126 | B82: arrow | D82: of:=[.A82] -> 10126 | E82: Šipka | F82: Arrow | G82: of:=[.A82] -> 10126 | H82: of:=COM.MICROSOFT.CONCAT([.$H$1];[.D82];[.$H$1]) -> "10126" | I82: of:=COM.MICROSOFT.CONCAT([.$H$1];[.F82];[.$H$1]) -> "Arrow" | J82: of:=COM.MICROSOFT.CONCAT("map.put(";[.H82];",";[.I82];");") -> map.put("10126","Arrow");
A83: 10127 | B83: highlight-cells | D83: of:=[.A83] -> 10127 | E83: Zvýraznit pole | F83: Highlight cells | G83: of:=[.A83] -> 10127 | H83: of:=COM.MICROSOFT.CONCAT([.$H$1];[.D83];[.$H$1]) -> "10127" | I83: of:=COM.MICROSOFT.CONCAT([.$H$1];[.F83];[.$H$1]) -> "Highlight cells" | J83: of:=COM.MICROSOFT.CONCAT("map.put(";[.H83];",";[.I83];");") -> map.put("10127","Highlight cells");
A84: 10140 | B84: load-default | D84: of:=[.A84] -> 10140 | E84: Načíst výchozí | F84: Load default | G84: of:=[.A84] -> 10140 | H84: of:=COM.MICROSOFT.CONCAT([.$H$1];[.D84];[.$H$1]) -> "10140" | I84: of:=COM.MICROSOFT.CONCAT([.$H$1];[.F84];[.$H$1]) -> "Load default" | J84: of:=COM.MICROSOFT.CONCAT("map.put(";[.H84];",";[.I84];");") -> map.put("10140","Load default");
A85: 10141 | B85: save-look-changes | D85: of:=[.A85] -> 10141 | E85: Uložit změny Vzhledu | F85: Save Look changes | G85: of:=[.A85] -> 10141 | H85: of:=COM.MICROSOFT.CONCAT([.$H$1];[.D85];[.$H$1]) -> "10141" | I85: of:=COM.MICROSOFT.CONCAT([.$H$1];[.F85];[.$H$1]) -> "Save Look changes" | J85: of:=COM.MICROSOFT.CONCAT("map.put(";[.H85];",";[.I85];");") -> map.put("10141","Save Look changes");
A86: 10601 | B86: look-changes-will-take-effect-after-next-sign-in. | D86: of:=[.A86] -> 10601 | E86: Změny vzhledu se projeví po příštím přihlášení. | F86: Look changes will take effect after next sign in. | G86: of:=[.A86] -> 10601 | H86: of:=COM.MICROSOFT.CONCAT([.$H$1];[.D86];[.$H$1]) -> "10601" | I86: of:=COM.MICROSOFT.CONCAT([.$H$1];[.F86];[.$H$1]) -> "Look changes will take effect after next sign in." | J86: of:=COM.MICROSOFT.CONCAT("map.put(";[.H86];",";[.I86];");") -> map.put("10601","Look changes will take effect after next sign in.");
A87: 10701 | B87: optional-data | D87: of:=[.A87] -> 10701 | E87: Volitelné údaje | F87: Optional data | G87: of:=[.A87] -> 10701 | H87: of:=COM.MICROSOFT.CONCAT([.$H$1];[.D87];[.$H$1]) -> "10701" | I87: of:=COM.MICROSOFT.CONCAT([.$H$1];[.F87];[.$H$1]) -> "Optional data" | J87: of:=COM.MICROSOFT.CONCAT("map.put(";[.H87];",";[.I87];");") -> map.put("10701","Optional data");
A88: 10711 | B88: name | D88: of:=[.A88] -> 10711 | E88: Jméno | F88: Name | G88: of:=[.A88] -> 10711 | H88: of:=COM.MICROSOFT.CONCAT([.$H$1];[.D88];[.$H$1]) -> "10711" | I88: of:=COM.MICROSOFT.CONCAT([.$H$1];[.F88];[.$H$1]) -> "Name" | J88: of:=COM.MICROSOFT.CONCAT("map.put(";[.H88];",";[.I88];");") -> map.put("10711","Name");
A89: 10712 | B89: surname | D89: of:=[.A89] -> 10712 | E89: Příjmení | F89: Surname | G89: of:=[.A89] -> 10712 | H89: of:=COM.MICROSOFT.CONCAT([.$H$1];[.D89];[.$H$1]) -> "10712" | I89: of:=COM.MICROSOFT.CONCAT([.$H$1];[.F89];[.$H$1]) -> "Surname" | J89: of:=COM.MICROSOFT.CONCAT("map.put(";[.H89];",";[.I89];");") -> map.put("10712","Surname");
A90: 10713 | B90: sex | D90: of:=[.A90] -> 10713 | E90: Pohlaví | F90: Sex | G90: of:=[.A90] -> 10713 | H90: of:=COM.MICROSOFT.CONCAT([.$H$1];[.D90];[.$H$1]) -> "10713" | I90: of:=COM.MICROSOFT.CONCAT([.$H$1];[.F90];[.$H$1]) -> "Sex" | J90: of:=COM.MICROSOFT.CONCAT("map.put(";[.H90];",";[.I90];");") -> map.put("10713","Sex");
A91: 10714 | B91: man | D91: of:=[.A91] -> 10714 | E91: Muž | F91: Man | G91: of:=[.A91] -> 10714 | H91: of:=COM.MICROSOFT.CONCAT([.$H$1];[.D91];[.$H$1]) -> "10714" | I91: of:=COM.MICROSOFT.CONCAT([.$H$1];[.F91];[.$H$1]) -> "Man" | J91: of:=COM.MICROSOFT.CONCAT("map.put(";[.H91];",";[.I91];");") -> map.put("10714","Man");
A92: 10715 | B92: woman | D92: of:=[.A92] -> 10715 | E92: Žena | F92: Woman | G92: of:=[.A92] -> 10715 | H92: of:=COM.MICROSOFT.CONCAT([.$H$1];[.D92];[.$H$1]) -> "10715" | I92: of:=COM.MICROSOFT.CONCAT([.$H$1];[.F92];[.$H$1]) -> "Woman" | J92: of:=COM.MICROSOFT.CONCAT("map.put(";[.H92];",";[.I92];");") -> map.put("10715","Woman");
A93: 10716 | B93: unknown | D93: of:=[.A93] -> 10716 | E93: Neznámé | F93: Unknown | G93: of:=[.A93] -> 10716 | H93: of:=COM.MICROSOFT.CONCAT([.$H$1];[.D93];[.$H$1]) -> "10716" | I93: of:=COM.MICROSOFT.CONCAT([.$H$1];[.F93];[.$H$1]) -> "Unknown" | J93: of:=COM.MICROSOFT.CONCAT("map.put(";[.H93];",";[.I93];");") -> map.put("10716","Unknown");
A94: 10717 | B94: date-of-birth | D94: of:=[.A94] -> 10717 | E94: Datum narození | F94: Date of birth | G94: of:=[.A94] -> 10717 | H94: of:=COM.MICROSOFT.CONCAT([.$H$1];[.D94];[.$H$1]) -> "10717" | I94: of:=COM.MICROSOFT.CONCAT([.$H$1];[.F94];[.$H$1]) -> "Date of birth" | J94: of:=COM.MICROSOFT.CONCAT("map.put(";[.H94];",";[.I94];");") -> map.put("10717","Date of birth");
A95: 10718 | B95: year | D95: of:=[.A95] -> 10718 | E95: Rok | F95: Year | G95: of:=[.A95] -> 10718 | H95: of:=COM.MICROSOFT.CONCAT([.$H$1];[.D95];[.$H$1]) -> "10718" | I95: of:=COM.MICROSOFT.CONCAT([.$H$1];[.F95];[.$H$1]) -> "Year" | J95: of:=COM.MICROSOFT.CONCAT("map.put(";[.H95];",";[.I95];");") -> map.put("10718","Year");
A96: 10719 | B96: month | D96: of:=[.A96] -> 10719 | E96: Měsíc | F96: Month | G96: of:=[.A96] -> 10719 | H96: of:=COM.MICROSOFT.CONCAT([.$H$1];[.D96];[.$H$1]) -> "10719" | I96: of:=COM.MICROSOFT.CONCAT([.$H$1];[.F96];[.$H$1]) -> "Month" | J96: of:=COM.MICROSOFT.CONCAT("map.put(";[.H96];",";[.I96];");") -> map.put("10719","Month");
A97: 10720 | B97: day | D97: of:=[.A97] -> 10720 | E97: Den | F97: Day | G97: of:=[.A97] -> 10720 | H97: of:=COM.MICROSOFT.CONCAT([.$H$1];[.D97];[.$H$1]) -> "10720" | I97: of:=COM.MICROSOFT.CONCAT([.$H$1];[.F97];[.$H$1]) -> "Day" | J97: of:=COM.MICROSOFT.CONCAT("map.put(";[.H97];",";[.I97];");") -> map.put("10720","Day");
A98: 10791 | B98: save-optional-data-changes | D98: of:=[.A98] -> 10791 | E98: Uložit změny Volitelných údajů | F98: Save Optional data changes | G98: of:=[.A98] -> 10791 | H98: of:=COM.MICROSOFT.CONCAT([.$H$1];[.D98];[.$H$1]) -> "10791" | I98: of:=COM.MICROSOFT.CONCAT([.$H$1];[.F98];[.$H$1]) -> "Save Optional data changes" | J98: of:=COM.MICROSOFT.CONCAT("map.put(";[.H98];",";[.I98];");") -> map.put("10791","Save Optional data changes");
A99: 10801 | B99: other | D99: of:=[.A99] -> 10801 | E99: Ostatní | F99: Other | G99: of:=[.A99] -> 10801 | H99: of:=COM.MICROSOFT.CONCAT([.$H$1];[.D99];[.$H$1]) -> "10801" | I99: of:=COM.MICROSOFT.CONCAT([.$H$1];[.F99];[.$H$1]) -> "Other" | J99: of:=COM.MICROSOFT.CONCAT("map.put(";[.H99];",";[.I99];");") -> map.put("10801","Other");
A100: 10811 | B100: time-zone | D100: of:=[.A100] -> 10811 | E100: Časová zóna | F100: Time zone | G100: of:=[.A100] -> 10811 | H100: of:=COM.MICROSOFT.CONCAT([.$H$1];[.D100];[.$H$1]) -> "10811" | I100: of:=COM.MICROSOFT.CONCAT([.$H$1];[.F100];[.$H$1]) -> "Time zone" | J100: of:=COM.MICROSOFT.CONCAT("map.put(";[.H100];",";[.I100];");") -> map.put("10811","Time zone");
A101: 10891 | B101: save-other-changes | D101: of:=[.A101] -> 10891 | E101: Uložit změny Ostatní | F101: Save Other Changes | G101: of:=[.A101] -> 10891 | H101: of:=COM.MICROSOFT.CONCAT([.$H$1];[.D101];[.$H$1]) -> "10891" | I101: of:=COM.MICROSOFT.CONCAT([.$H$1];[.F101];[.$H$1]) -> "Save Other Changes" | J101: of:=COM.MICROSOFT.CONCAT("map.put(";[.H101];",";[.I101];");") -> map.put("10891","Save Other Changes");
A102: 10901 | B102: before-signing | D102: of:=[.A102] -> 10901 | E102: Před přihlášením | F102: Before signing | G102: of:=[.A102] -> 10901 | H102: of:=COM.MICROSOFT.CONCAT([.$H$1];[.D102];[.$H$1]) -> "10901" | I102: of:=COM.MICROSOFT.CONCAT([.$H$1];[.F102];[.$H$1]) -> "Before signing" | J102: of:=COM.MICROSOFT.CONCAT("map.put(";[.H102];",";[.I102];");") -> map.put("10901","Before signing");
A103: 10991 | B103: save-before-signing-changes | D103: of:=[.A103] -> 10991 | E103: Uložit změny Před přihlášením | F103: Save Before signing changes | G103: of:=[.A103] -> 10991 | H103: of:=COM.MICROSOFT.CONCAT([.$H$1];[.D103];[.$H$1]) -> "10991" | I103: of:=COM.MICROSOFT.CONCAT([.$H$1];[.F103];[.$H$1]) -> "Save Before signing changes" | J103: of:=COM.MICROSOFT.CONCAT("map.put(";[.H103];",";[.I103];");") -> map.put("10991","Save Before signing changes");
A104: 20000 | B104: custom-composition | D104: of:=[.A104] -> 20000 | E104: Vlastní sestava | F104: Custom composition | G104: of:=[.A104] -> 20000 | H104: of:=COM.MICROSOFT.CONCAT([.$H$1];[.D104];[.$H$1]) -> "20000" | I104: of:=COM.MICROSOFT.CONCAT([.$H$1];[.F104];[.$H$1]) -> "Custom composition" | J104: of:=COM.MICROSOFT.CONCAT("map.put(";[.H104];",";[.I104];");") -> map.put("20000","Custom composition");
A105: 20001 | B105: yes | D105: of:=[.A105] -> 20001 | E105: Ano | F105: Yes | G105: of:=[.A105] -> 20001 | H105: of:=COM.MICROSOFT.CONCAT([.$H$1];[.D105];[.$H$1]) -> "20001" | I105: of:=COM.MICROSOFT.CONCAT([.$H$1];[.F105];[.$H$1]) -> "Yes" | J105: of:=COM.MICROSOFT.CONCAT("map.put(";[.H105];",";[.I105];");") -> map.put("20001","Yes");
A106: 20002 | B106: no | D106: of:=[.A106] -> 20002 | E106: Ne | F106: No | G106: of:=[.A106] -> 20002 | H106: of:=COM.MICROSOFT.CONCAT([.$H$1];[.D106];[.$H$1]) -> "20002" | I106: of:=COM.MICROSOFT.CONCAT([.$H$1];[.F106];[.$H$1]) -> "No" | J106: of:=COM.MICROSOFT.CONCAT("map.put(";[.H106];",";[.I106];");") -> map.put("20002","No");
A107: 20003 | B107: begin | D107: of:=[.A107] -> 20003 | E107: Začít | F107: Begin | G107: of:=[.A107] -> 20003 | H107: of:=COM.MICROSOFT.CONCAT([.$H$1];[.D107];[.$H$1]) -> "20003" | I107: of:=COM.MICROSOFT.CONCAT([.$H$1];[.F107];[.$H$1]) -> "Begin" | J107: of:=COM.MICROSOFT.CONCAT("map.put(";[.H107];",";[.I107];");") -> map.put("20003","Begin");
A108: 20004 | B108: load | D108: of:=[.A108] -> 20004 | E108: Načíst | F108: Load | G108: of:=[.A108] -> 20004 | H108: of:=COM.MICROSOFT.CONCAT([.$H$1];[.D108];[.$H$1]) -> "20004" | I108: of:=COM.MICROSOFT.CONCAT([.$H$1];[.F108];[.$H$1]) -> "Load" | J108: of:=COM.MICROSOFT.CONCAT("map.put(";[.H108];",";[.I108];");") -> map.put("20004","Load");
A109: 20005 | B109: default | D109: of:=[.A109] -> 20005 | E109: Výchozí | F109: Default | G109: of:=[.A109] -> 20005 | H109: of:=COM.MICROSOFT.CONCAT([.$H$1];[.D109];[.$H$1]) -> "20005" | I109: of:=COM.MICROSOFT.CONCAT([.$H$1];[.F109];[.$H$1]) -> "Default" | J109: of:=COM.MICROSOFT.CONCAT("map.put(";[.H109];",";[.I109];");") -> map.put("20005","Default");
A110: 20006 | B110: random | D110: of:=[.A110] -> 20006 | E110: Náhodně | F110: Random | G110: of:=[.A110] -> 20006 | H110: of:=COM.MICROSOFT.CONCAT([.$H$1];[.D110];[.$H$1]) -> "20006" | I110: of:=COM.MICROSOFT.CONCAT([.$H$1];[.F110];[.$H$1]) -> "Random" | J110: of:=COM.MICROSOFT.CONCAT("map.put(";[.H110];",";[.I110];");") -> map.put("20006","Random");
A111: 20100 | B111: board | D111: of:=[.A111] -> 20100 | E111: Deska | F111: Board | G111: of:=[.A111] -> 20100 | H111: of:=COM.MICROSOFT.CONCAT([.$H$1];[.D111];[.$H$1]) -> "20100" | I111: of:=COM.MICROSOFT.CONCAT([.$H$1];[.F111];[.$H$1]) -> "Board" | J111: of:=COM.MICROSOFT.CONCAT("map.put(";[.H111];",";[.I111];");") -> map.put("20100","Board");
A112: 20101 | B112: height | D112: of:=[.A112] -> 20101 | E112: Výška | F112: Height | G112: of:=[.A112] -> 20101 | H112: of:=COM.MICROSOFT.CONCAT([.$H$1];[.D112];[.$H$1]) -> "20101" | I112: of:=COM.MICROSOFT.CONCAT([.$H$1];[.F112];[.$H$1]) -> "Height" | J112: of:=COM.MICROSOFT.CONCAT("map.put(";[.H112];",";[.I112];");") -> map.put("20101","Height");
A113: 20102 | B113: width | D113: of:=[.A113] -> 20102 | E113: Šířka | F113: Width | G113: of:=[.A113] -> 20102 | H113: of:=COM.MICROSOFT.CONCAT([.$H$1];[.D113];[.$H$1]) -> "20102" | I113: of:=COM.MICROSOFT.CONCAT([.$H$1];[.F113];[.$H$1]) -> "Width" | J113: of:=COM.MICROSOFT.CONCAT("map.put(";[.H113];",";[.I113];");") -> map.put("20102","Width");
A114: 20103 | B114: grid-probability | D114: of:=[.A114] -> 20103 | E114: Pravděpodobnost zamknutí | F114: Grid probability | G114: of:=[.A114] -> 20103 | H114: of:=COM.MICROSOFT.CONCAT([.$H$1];[.D114];[.$H$1]) -> "20103" | I114: of:=COM.MICROSOFT.CONCAT([.$H$1];[.F114];[.$H$1]) -> "Grid probability" | J114: of:=COM.MICROSOFT.CONCAT("map.put(";[.H114];",";[.I114];");") -> map.put("20103","Grid probability");
A115: 20104 | B115: grid-count | D115: of:=[.A115] -> 20104 | E115: Počet zamknutí | F115: Grid count | G115: of:=[.A115] -> 20104 | H115: of:=COM.MICROSOFT.CONCAT([.$H$1];[.D115];[.$H$1]) -> "20104" | I115: of:=COM.MICROSOFT.CONCAT([.$H$1];[.F115];[.$H$1]) -> "Grid count" | J115: of:=COM.MICROSOFT.CONCAT("map.put(";[.H115];",";[.I115];");") -> map.put("20104","Grid count");
A116: 20105 | B116: wall-probability | D116: of:=[.A116] -> 20105 | E116: Pravděpodobnost stěn | F116: Wall probability | G116: of:=[.A116] -> 20105 | H116: of:=COM.MICROSOFT.CONCAT([.$H$1];[.D116];[.$H$1]) -> "20105" | I116: of:=COM.MICROSOFT.CONCAT([.$H$1];[.F116];[.$H$1]) -> "Wall probability" | J116: of:=COM.MICROSOFT.CONCAT("map.put(";[.H116];",";[.I116];");") -> map.put("20105","Wall probability");
A117: 20106 | B117: wall-count | D117: of:=[.A117] -> 20106 | E117: Počet stěn | F117: Wall count | G117: of:=[.A117] -> 20106 | H117: of:=COM.MICROSOFT.CONCAT([.$H$1];[.D117];[.$H$1]) -> "20106" | I117: of:=COM.MICROSOFT.CONCAT([.$H$1];[.F117];[.$H$1]) -> "Wall count" | J117: of:=COM.MICROSOFT.CONCAT("map.put(";[.H117];",";[.I117];");") -> map.put("20106","Wall count");
A118: 20107 | B118: set-holes | D118: of:=[.A118] -> 20107 | E118: Nastavit díry | F118: Set holes | G118: of:=[.A118] -> 20107 | H118: of:=COM.MICROSOFT.CONCAT([.$H$1];[.D118];[.$H$1]) -> "20107" | I118: of:=COM.MICROSOFT.CONCAT([.$H$1];[.F118];[.$H$1]) -> "Set holes" | J118: of:=COM.MICROSOFT.CONCAT("map.put(";[.H118];",";[.I118];");") -> map.put("20107","Set holes");
A119: 20108 | B119: clear-all-holes | D119: of:=[.A119] -> 20108 | E119: Zrušit všechny díry | F119: Clear all holes | G119: of:=[.A119] -> 20108 | H119: of:=COM.MICROSOFT.CONCAT([.$H$1];[.D119];[.$H$1]) -> "20108" | I119: of:=COM.MICROSOFT.CONCAT([.$H$1];[.F119];[.$H$1]) -> "Clear all holes" | J119: of:=COM.MICROSOFT.CONCAT("map.put(";[.H119];",";[.I119];");") -> map.put("20108","Clear all holes");
A120: 20121 | B120: height-must-be-3-at-least. | D120: of:=[.A120] -> 20121 | E120: Výška může být nejméně tři. | F120: Height must be 3 at least. | G120: of:=[.A120] -> 20121 | H120: of:=COM.MICROSOFT.CONCAT([.$H$1];[.D120];[.$H$1]) -> "20121" | I120: of:=COM.MICROSOFT.CONCAT([.$H$1];[.F120];[.$H$1]) -> "Height must be 3 at least." | J120: of:=COM.MICROSOFT.CONCAT("map.put(";[.H120];",";[.I120];");") -> map.put("20121","Height must be 3 at least.");
A121: 20122 | B121: height-must-be-32-at-most. | D121: of:=[.A121] -> 20122 | E121: Výška může být maximálně 32. | F121: Height must be 32 at most. | G121: of:=[.A121] -> 20122 | H121: of:=COM.MICROSOFT.CONCAT([.$H$1];[.D121];[.$H$1]) -> "20122" | I121: of:=COM.MICROSOFT.CONCAT([.$H$1];[.F121];[.$H$1]) -> "Height must be 32 at most." | J121: of:=COM.MICROSOFT.CONCAT("map.put(";[.H121];",";[.I121];");") -> map.put("20122","Height must be 32 at most.");
A122: 20123 | B122: width-must-be-3-at-least. | D122: of:=[.A122] -> 20123 | E122: Šířka může být 3 nejméně. | F122: Width must be 3 at least. | G122: of:=[.A122] -> 20123 | H122: of:=COM.MICROSOFT.CONCAT([.$H$1];[.D122];[.$H$1]) -> "20123" | I122: of:=COM.MICROSOFT.CONCAT([.$H$1];[.F122];[.$H$1]) -> "Width must be 3 at least." | J122: of:=COM.MICROSOFT.CONCAT("map.put(";[.H122];",";[.I122];");") -> map.put("20123","Width must be 3 at least.");
A123: 20124 | B123: width-must-be-32-at-most. | D123: of:=[.A123] -> 20124 | E123: Šířka může být maximálně 32. | F123: Width must be 32 at most. | G123: of:=[.A123] -> 20124 | H123: of:=COM.MICROSOFT.CONCAT([.$H$1];[.D123];[.$H$1]) -> "20124" | I123: of:=COM.MICROSOFT.CONCAT([.$H$1];[.F123];[.$H$1]) -> "Width must be 32 at most." | J123: of:=COM.MICROSOFT.CONCAT("map.put(";[.H123];",";[.I123];");") -> map.put("20124","Width must be 32 at most.");
A124: 20125 | B124: for-0-wall-probability-cannot-be-wall-count-higher-than-0. | D124: of:=[.A124] -> 20125 | E124: Pro nulovou pravděpodobnost stěny nemůže být počet zdí vyšší než 0. | F124: For 0 Wall probability cannot be Wall count higher than 0. | G124: of:=[.A124] -> 20125 | H124: of:=COM.MICROSOFT.CONCAT([.$H$1];[.D124];[.$H$1]) -> "20125" | I124: of:=COM.MICROSOFT.CONCAT([.$H$1];[.F124];[.$H$1]) -> "For 0 Wall probability cannot be Wall count higher than 0." | J124: of:=COM.MICROSOFT.CONCAT("map.put(";[.H124];",";[.I124];");") -> map.put("20125","For 0 Wall probability cannot be Wall count higher than 0.");
A125: 20126 | B125: for-0-grid-probability-cannot-be-grid-count-higher-than-0. | D125: of:=[.A125] -> 20126 | E125: Pro nulovou pravděpodobností zamknutí nemůže být počet zamknutí vyšší než 0. | F125: For 0 Grid probability cannot be Grid count higher than 0. | G125: of:=[.A125] -> 20126 | H125: of:=COM.MICROSOFT.CONCAT([.$H$1];[.D125];[.$H$1]) -> "20126" | I125: of:=COM.MICROSOFT.CONCAT([.$H$1];[.F125];[.$H$1]) -> "For 0 Grid probability cannot be Grid count higher than 0." | J125: of:=COM.MICROSOFT.CONCAT("map.put(";[.H125];",";[.I125];");") -> map.put("20126","For 0 Grid probability cannot be Grid count higher than 0.");
A126: 20127 | B126: probability-cannot-be-higher-than-100-percent. | D126: of:=[.A126] -> 20127 | E126: Pravděpodobnost nemůže být vyšší než 100 procent. | F126: Probability cannot be higher than 100 percent. | G126: of:=[.A126] -> 20127 | H126: of:=COM.MICROSOFT.CONCAT([.$H$1];[.D126];[.$H$1]) -> "20127" | I126: of:=COM.MICROSOFT.CONCAT([.$H$1];[.F126];[.$H$1]) -> "Probability cannot be higher than 100 percent." | J126: of:=COM.MICROSOFT.CONCAT("map.put(";[.H126];",";[.I126];");") -> map.put("20127","Probability cannot be higher than 100 percent.");
A127: 20128 | B127: probability-cannot-be-lower-than-0-percent. | D127: of:=[.A127] -> 20128 | E127: Pravděpodobnost nemůže být nižší než 0 procent. | F127: Probability cannot be lower than 0 percent. | G127: of:=[.A127] -> 20128 | H127: of:=COM.MICROSOFT.CONCAT([.$H$1];[.D127];[.$H$1]) -> "20128" | I127: of:=COM.MICROSOFT.CONCAT([.$H$1];[.F127];[.$H$1]) -> "Probability cannot be lower than 0 percent." | J127: of:=COM.MICROSOFT.CONCAT("map.put(";[.H127];",";[.I127];");") -> map.put("20128","Probability cannot be lower than 0 percent.");
A128: 20129 | B128: wall-count-cannot-be-higher-than-4-*-boardheight-*-boardwidth. | D128: of:=[.A128] -> 20129 | E128: Počet zdí nemůže být vyšší než 4 * výška * šířka. | F128: Wall count cannot be higher than 4 * boardHeight * boardWidth. | G128: of:=[.A128] -> 20129 | H128: of:=COM.MICROSOFT.CONCAT([.$H$1];[.D128];[.$H$1]) -> "20129" | I128: of:=COM.MICROSOFT.CONCAT([.$H$1];[.F128];[.$H$1]) -> "Wall count cannot be higher than 4 * boardHeight * boardWidth." | J128: of:=COM.MICROSOFT.CONCAT("map.put(";[.H128];",";[.I128];");") -> map.put("20129","Wall count cannot be higher than 4 * boardHeight * boardWidth.");
A129: 20130 | B129: grid-count-cannot-be-higher-than-boardheight-*-boardwidth. | D129: of:=[.A129] -> 20130 | E129: Počet zamknutí nemůže být vyšší než výška * šířka. | F129: Grid count cannot be higher than boardHeight * boardWidth. | G129: of:=[.A129] -> 20130 | H129: of:=COM.MICROSOFT.CONCAT([.$H$1];[.D129];[.$H$1]) -> "20130" | I129: of:=COM.MICROSOFT.CONCAT([.$H$1];[.F129];[.$H$1]) -> "Grid count cannot be higher than boardHeight * boardWidth." | J129: of:=COM.MICROSOFT.CONCAT("map.put(";[.H129];",";[.I129];");") -> map.put("20130","Grid count cannot be higher than boardHeight * boardWidth.");
A130: 20131 | B130: you-have-changed-boardheight-or-boardwidth-after-you-set-holes.-clear-all-holes-or-set-the-right-dimensions | D130: of:=[.A130] -> 20131 | E130: Změnili jste výšku nebo na šířku po nastavení děr. Vymažte všechny díry nebo nastavte správné rozměry. | F130: You have changed boardHeight or boardWidth after you set holes. Clear all holes or set the right dimensions | G130: of:=[.A130] -> 20131 | H130: of:=COM.MICROSOFT.CONCAT([.$H$1];[.D130];[.$H$1]) -> "20131" | I130: of:=COM.MICROSOFT.CONCAT([.$H$1];[.F130];[.$H$1]) -> "You have changed boardHeight or boardWidth after you set holes. Clear all holes or set the right dimensions" | J130: of:=COM.MICROSOFT.CONCAT("map.put(";[.H130];",";[.I130];");") -> map.put("20131","You have changed boardHeight or boardWidth after you set holes. Clear all holes or set the right dimensions");
A131: 20200 | B131: balls | D131: of:=[.A131] -> 20200 | E131: Míče | F131: Balls | G131: of:=[.A131] -> 20200 | H131: of:=COM.MICROSOFT.CONCAT([.$H$1];[.D131];[.$H$1]) -> "20200" | I131: of:=COM.MICROSOFT.CONCAT([.$H$1];[.F131];[.$H$1]) -> "Balls" | J131: of:=COM.MICROSOFT.CONCAT("map.put(";[.H131];",";[.I131];");") -> map.put("20200","Balls");
A132: 20201 | B132: colour-frequencies | D132: of:=[.A132] -> 20201 | E132: Frekvence barev | F132: Colour frequencies | G132: of:=[.A132] -> 20201 | H132: of:=COM.MICROSOFT.CONCAT([.$H$1];[.D132];[.$H$1]) -> "20201" | I132: of:=COM.MICROSOFT.CONCAT([.$H$1];[.F132];[.$H$1]) -> "Colour frequencies" | J132: of:=COM.MICROSOFT.CONCAT("map.put(";[.H132];",";[.I132];");") -> map.put("20201","Colour frequencies");
A133: 20202 | B133: 0-frequency-for-all-colours-is-forbidden. | D133: of:=[.A133] -> 20202 | E133: Nulová frekvence všech barev je zakázána. | F133: 0 frequency for all colours is forbidden. | G133: of:=[.A133] -> 20202 | H133: of:=COM.MICROSOFT.CONCAT([.$H$1];[.D133];[.$H$1]) -> "20202" | I133: of:=COM.MICROSOFT.CONCAT([.$H$1];[.F133];[.$H$1]) -> "0 frequency for all colours is forbidden." | J133: of:=COM.MICROSOFT.CONCAT("map.put(";[.H133];",";[.I133];");") -> map.put("20202","0 frequency for all colours is forbidden.");
A134: 20221 | B134: values | D134: of:=[.A134] -> 20221 | E134: Hodnoty | F134: Values | G134: of:=[.A134] -> 20221 | H134: of:=COM.MICROSOFT.CONCAT([.$H$1];[.D134];[.$H$1]) -> "20221" | I134: of:=COM.MICROSOFT.CONCAT([.$H$1];[.F134];[.$H$1]) -> "Values" | J134: of:=COM.MICROSOFT.CONCAT("map.put(";[.H134];",";[.I134];");") -> map.put("20221","Values");
A135: 20222 | B135: value--2-frequency | D135: of:=[.A135] -> 20222 | E135: Frekvence hodnoty -2 | F135: Value -2 frequency | G135: of:=[.A135] -> 20222 | H135: of:=COM.MICROSOFT.CONCAT([.$H$1];[.D135];[.$H$1]) -> "20222" | I135: of:=COM.MICROSOFT.CONCAT([.$H$1];[.F135];[.$H$1]) -> "Value -2 frequency" | J135: of:=COM.MICROSOFT.CONCAT("map.put(";[.H135];",";[.I135];");") -> map.put("20222","Value -2 frequency");
A136: 20223 | B136: value--1-frequency | D136: of:=[.A136] -> 20223 | E136: Frekvence hodnoty -1 | F136: Value -1 frequency | G136: of:=[.A136] -> 20223 | H136: of:=COM.MICROSOFT.CONCAT([.$H$1];[.D136];[.$H$1]) -> "20223" | I136: of:=COM.MICROSOFT.CONCAT([.$H$1];[.F136];[.$H$1]) -> "Value -1 frequency" | J136: of:=COM.MICROSOFT.CONCAT("map.put(";[.H136];",";[.I136];");") -> map.put("20223","Value -1 frequency");
A137: 20224 | B137: value-0-frequency | D137: of:=[.A137] -> 20224 | E137: Frekvence hodnoty 0 | F137: Value 0 frequency | G137: of:=[.A137] -> 20224 | H137: of:=COM.MICROSOFT.CONCAT([.$H$1];[.D137];[.$H$1]) -> "20224" | I137: of:=COM.MICROSOFT.CONCAT([.$H$1];[.F137];[.$H$1]) -> "Value 0 frequency" | J137: of:=COM.MICROSOFT.CONCAT("map.put(";[.H137];",";[.I137];");") -> map.put("20224","Value 0 frequency");
A138: 20225 | B138: value-1-frequency | D138: of:=[.A138] -> 20225 | E138: Frekvence hodnoty 1 | F138: Value 1 frequency | G138: of:=[.A138] -> 20225 | H138: of:=COM.MICROSOFT.CONCAT([.$H$1];[.D138];[.$H$1]) -> "20225" | I138: of:=COM.MICROSOFT.CONCAT([.$H$1];[.F138];[.$H$1]) -> "Value 1 frequency" | J138: of:=COM.MICROSOFT.CONCAT("map.put(";[.H138];",";[.I138];");") -> map.put("20225","Value 1 frequency");
A139: 20226 | B139: value-2-frequency | D139: of:=[.A139] -> 20226 | E139: Frekvence hodnoty 2 | F139: Value 2 frequency | G139: of:=[.A139] -> 20226 | H139: of:=COM.MICROSOFT.CONCAT([.$H$1];[.D139];[.$H$1]) -> "20226" | I139: of:=COM.MICROSOFT.CONCAT([.$H$1];[.F139];[.$H$1]) -> "Value 2 frequency" | J139: of:=COM.MICROSOFT.CONCAT("map.put(";[.H139];",";[.I139];");") -> map.put("20226","Value 2 frequency");
A140: 20240 | B140: other | D140: of:=[.A140] -> 20240 | E140: Ostatní | F140: Other | G140: of:=[.A140] -> 20240 | H140: of:=COM.MICROSOFT.CONCAT([.$H$1];[.D140];[.$H$1]) -> "20240" | I140: of:=COM.MICROSOFT.CONCAT([.$H$1];[.F140];[.$H$1]) -> "Other" | J140: of:=COM.MICROSOFT.CONCAT("map.put(";[.H140];",";[.I140];");") -> map.put("20240","Other");
A141: 20241 | B141: colour-ball-frequency | D141: of:=[.A141] -> 20241 | E141: Frekvence barevných míčů | F141: Colour ball frequency | G141: of:=[.A141] -> 20241 | H141: of:=COM.MICROSOFT.CONCAT([.$H$1];[.D141];[.$H$1]) -> "20241" | I141: of:=COM.MICROSOFT.CONCAT([.$H$1];[.F141];[.$H$1]) -> "Colour ball frequency" | J141: of:=COM.MICROSOFT.CONCAT("map.put(";[.H141];",";[.I141];");") -> map.put("20241","Colour ball frequency");
A142: 20242 | B142: rainbow-ball-frequency | D142: of:=[.A142] -> 20242 | E142: Frekvence duhových míčů | F142: Rainbow ball frequency | G142: of:=[.A142] -> 20242 | H142: of:=COM.MICROSOFT.CONCAT([.$H$1];[.D142];[.$H$1]) -> "20242" | I142: of:=COM.MICROSOFT.CONCAT([.$H$1];[.F142];[.$H$1]) -> "Rainbow ball frequency" | J142: of:=COM.MICROSOFT.CONCAT("map.put(";[.H142];",";[.I142];");") -> map.put("20242","Rainbow ball frequency");
A143: 20243 | B143: unmoveable-balls-probability | D143: of:=[.A143] -> 20243 | E143: Pravděpodobnost nepřesunutelného míče | F143: Unmoveable balls probability | G143: of:=[.A143] -> 20243 | H143: of:=COM.MICROSOFT.CONCAT([.$H$1];[.D143];[.$H$1]) -> "20243" | I143: of:=COM.MICROSOFT.CONCAT([.$H$1];[.F143];[.$H$1]) -> "Unmoveable balls probability" | J143: of:=COM.MICROSOFT.CONCAT("map.put(";[.H143];",";[.I143];");") -> map.put("20243","Unmoveable balls probability");
A144: 20244 | B144: unbreakable-balls-probability | D144: of:=[.A144] -> 20244 | E144: Pravděpodobnost nerozbitného míče | F144: Unbreakable balls probability | G144: of:=[.A144] -> 20244 | H144: of:=COM.MICROSOFT.CONCAT([.$H$1];[.D144];[.$H$1]) -> "20244" | I144: of:=COM.MICROSOFT.CONCAT([.$H$1];[.F144];[.$H$1]) -> "Unbreakable balls probability" | J144: of:=COM.MICROSOFT.CONCAT("map.put(";[.H144];",";[.I144];");") -> map.put("20244","Unbreakable balls probability");
A145: 20300 | B145: thrower | D145: of:=[.A145] -> 20300 | E145: Házeč | F145: Thrower | G145: of:=[.A145] -> 20300 | H145: of:=COM.MICROSOFT.CONCAT([.$H$1];[.D145];[.$H$1]) -> "20300" | I145: of:=COM.MICROSOFT.CONCAT([.$H$1];[.F145];[.$H$1]) -> "Thrower" | J145: of:=COM.MICROSOFT.CONCAT("map.put(";[.H145];",";[.I145];");") -> map.put("20300","Thrower");
A146: 20301 | B146: count-of-balls-thrown-at-the-start-of-the-game: | D146: of:=[.A146] -> 20301 | E146: Počet míčů hozených na začátku hry | F146: Count of balls thrown at the start of the game: | G146: of:=[.A146] -> 20301 | H146: of:=COM.MICROSOFT.CONCAT([.$H$1];[.D146];[.$H$1]) -> "20301" | I146: of:=COM.MICROSOFT.CONCAT([.$H$1];[.F146];[.$H$1]) -> "Count of balls thrown at the start of the game:" | J146: of:=COM.MICROSOFT.CONCAT("map.put(";[.H146];",";[.I146];");") -> map.put("20301","Count of balls thrown at the start of the game:");
A147: 20302 | B147: count-of-balls-throwing-during-the-game | D147: of:=[.A147] -> 20302 | E147: Počet míčů házených během hry | F147: Count of balls throwing during the game | G147: of:=[.A147] -> 20302 | H147: of:=COM.MICROSOFT.CONCAT([.$H$1];[.D147];[.$H$1]) -> "20302" | I147: of:=COM.MICROSOFT.CONCAT([.$H$1];[.F147];[.$H$1]) -> "Count of balls throwing during the game" | J147: of:=COM.MICROSOFT.CONCAT("map.put(";[.H147];",";[.I147];");") -> map.put("20302","Count of balls throwing during the game");
A148: 20303 | B148: ball-frequency | D148: of:=[.A148] -> 20303 | E148: Frekvence míčů | F148: Ball frequency | G148: of:=[.A148] -> 20303 | H148: of:=COM.MICROSOFT.CONCAT([.$H$1];[.D148];[.$H$1]) -> "20303" | I148: of:=COM.MICROSOFT.CONCAT([.$H$1];[.F148];[.$H$1]) -> "Ball frequency" | J148: of:=COM.MICROSOFT.CONCAT("map.put(";[.H148];",";[.I148];");") -> map.put("20303","Ball frequency");
A149: 20304 | B149: automatic-bomb-frequency | D149: of:=[.A149] -> 20304 | E149: Frekvence automatických bomb | F149: Automatic bomb frequency | G149: of:=[.A149] -> 20304 | H149: of:=COM.MICROSOFT.CONCAT([.$H$1];[.D149];[.$H$1]) -> "20304" | I149: of:=COM.MICROSOFT.CONCAT([.$H$1];[.F149];[.$H$1]) -> "Automatic bomb frequency" | J149: of:=COM.MICROSOFT.CONCAT("map.put(";[.H149];",";[.I149];");") -> map.put("20304","Automatic bomb frequency");
A150: 20305 | B150: manual-bomb-frequency | D150: of:=[.A150] -> 20305 | E150: Frekvence ručních bomb | F150: Manual bomb frequency | G150: of:=[.A150] -> 20305 | H150: of:=COM.MICROSOFT.CONCAT([.$H$1];[.D150];[.$H$1]) -> "20305" | I150: of:=COM.MICROSOFT.CONCAT([.$H$1];[.F150];[.$H$1]) -> "Manual bomb frequency" | J150: of:=COM.MICROSOFT.CONCAT("map.put(";[.H150];",";[.I150];");") -> map.put("20305","Manual bomb frequency");
A151: 20306 | B151: show-the-positions-of-the-next-balls | D151: of:=[.A151] -> 20306 | E151: Ukázat pozice dalších míčů | F151: Show the positions of the next balls | G151: of:=[.A151] -> 20306 | H151: of:=COM.MICROSOFT.CONCAT([.$H$1];[.D151];[.$H$1]) -> "20306" | I151: of:=COM.MICROSOFT.CONCAT([.$H$1];[.F151];[.$H$1]) -> "Show the positions of the next balls" | J151: of:=COM.MICROSOFT.CONCAT("map.put(";[.H151];",";[.I151];");") -> map.put("20306","Show the positions of the next balls");
A152: 20400 | B152: detonator | D152: of:=[.A152] -> 20400 | E152: Detonátor | F152: Detonator | G152: of:=[.A152] -> 20400 | H152: of:=COM.MICROSOFT.CONCAT([.$H$1];[.D152];[.$H$1]) -> "20400" | I152: of:=COM.MICROSOFT.CONCAT([.$H$1];[.F152];[.$H$1]) -> "Detonator" | J152: of:=COM.MICROSOFT.CONCAT("map.put(";[.H152];",";[.I152];");") -> map.put("20400","Detonator");
A153: 20401 | B153: shape-to-explode | D153: of:=[.A153] -> 20401 | E153: Tvar k explozi | F153: Shape to explode | G153: of:=[.A153] -> 20401 | H153: of:=COM.MICROSOFT.CONCAT([.$H$1];[.D153];[.$H$1]) -> "20401" | I153: of:=COM.MICROSOFT.CONCAT([.$H$1];[.F153];[.$H$1]) -> "Shape to explode" | J153: of:=COM.MICROSOFT.CONCAT("map.put(";[.H153];",";[.I153];");") -> map.put("20401","Shape to explode");
A154: 20402 | B154: line | D154: of:=[.A154] -> 20402 | E154: Čára | F154: Line | G154: of:=[.A154] -> 20402 | H154: of:=COM.MICROSOFT.CONCAT([.$H$1];[.D154];[.$H$1]) -> "20402" | I154: of:=COM.MICROSOFT.CONCAT([.$H$1];[.F154];[.$H$1]) -> "Line" | J154: of:=COM.MICROSOFT.CONCAT("map.put(";[.H154];",";[.I154];");") -> map.put("20402","Line");
A155: 20403 | B155: block | D155: of:=[.A155] -> 20403 | E155: Blok | F155: Block | G155: of:=[.A155] -> 20403 | H155: of:=COM.MICROSOFT.CONCAT([.$H$1];[.D155];[.$H$1]) -> "20403" | I155: of:=COM.MICROSOFT.CONCAT([.$H$1];[.F155];[.$H$1]) -> "Block" | J155: of:=COM.MICROSOFT.CONCAT("map.put(";[.H155];",";[.I155];");") -> map.put("20403","Block");
A156: 20404 | B156: rectangle | D156: of:=[.A156] -> 20404 | E156: Čtverec | F156: Rectangle | G156: of:=[.A156] -> 20404 | H156: of:=COM.MICROSOFT.CONCAT([.$H$1];[.D156];[.$H$1]) -> "20404" | I156: of:=COM.MICROSOFT.CONCAT([.$H$1];[.F156];[.$H$1]) -> "Rectangle" | J156: of:=COM.MICROSOFT.CONCAT("map.put(";[.H156];",";[.I156];");") -> map.put("20404","Rectangle");
A157: 20405 | B157: ring | D157: of:=[.A157] -> 20405 | E157: Kroužek | F157: Ring | G157: of:=[.A157] -> 20405 | H157: of:=COM.MICROSOFT.CONCAT([.$H$1];[.D157];[.$H$1]) -> "20405" | I157: of:=COM.MICROSOFT.CONCAT([.$H$1];[.F157];[.$H$1]) -> "Ring" | J157: of:=COM.MICROSOFT.CONCAT("map.put(";[.H157];",";[.I157];");") -> map.put("20405","Ring");
A158: 20406 | B158: custom | D158: of:=[.A158] -> 20406 | E158: Vlastní | F158: Custom | G158: of:=[.A158] -> 20406 | H158: of:=COM.MICROSOFT.CONCAT([.$H$1];[.D158];[.$H$1]) -> "20406" | I158: of:=COM.MICROSOFT.CONCAT([.$H$1];[.F158];[.$H$1]) -> "Custom" | J158: of:=COM.MICROSOFT.CONCAT("map.put(";[.H158];",";[.I158];");") -> map.put("20406","Custom");
A159: 20411 | B159: minimum-lenght | D159: of:=[.A159] -> 20411 | E159: Minimální délka | F159: Minimum lenght | G159: of:=[.A159] -> 20411 | H159: of:=COM.MICROSOFT.CONCAT([.$H$1];[.D159];[.$H$1]) -> "20411" | I159: of:=COM.MICROSOFT.CONCAT([.$H$1];[.F159];[.$H$1]) -> "Minimum lenght" | J159: of:=COM.MICROSOFT.CONCAT("map.put(";[.H159];",";[.I159];");") -> map.put("20411","Minimum lenght");
A160: 20412 | B160: minimum-size | D160: of:=[.A160] -> 20412 | E160: Minimální velikost | F160: Minimum size | G160: of:=[.A160] -> 20412 | H160: of:=COM.MICROSOFT.CONCAT([.$H$1];[.D160];[.$H$1]) -> "20412" | I160: of:=COM.MICROSOFT.CONCAT([.$H$1];[.F160];[.$H$1]) -> "Minimum size" | J160: of:=COM.MICROSOFT.CONCAT("map.put(";[.H160];",";[.I160];");") -> map.put("20412","Minimum size");
A161: 20421 | B161: set-custom-shape-to-explode | D161: of:=[.A161] -> 20421 | E161: Nastavit vlastní tvar k explozi | F161: Set custom shape to explode | G161: of:=[.A161] -> 20421 | H161: of:=COM.MICROSOFT.CONCAT([.$H$1];[.D161];[.$H$1]) -> "20421" | I161: of:=COM.MICROSOFT.CONCAT([.$H$1];[.F161];[.$H$1]) -> "Set custom shape to explode" | J161: of:=COM.MICROSOFT.CONCAT("map.put(";[.H161];",";[.I161];");") -> map.put("20421","Set custom shape to explode");
A162: 20431 | B162: ball-count-must-be-3-at-least. | D162: of:=[.A162] -> 20431 | E162: Počet Míčů musí být nejméně tři. | F162: Ball count must be 3 at least. | G162: of:=[.A162] -> 20431 | H162: of:=COM.MICROSOFT.CONCAT([.$H$1];[.D162];[.$H$1]) -> "20431" | I162: of:=COM.MICROSOFT.CONCAT([.$H$1];[.F162];[.$H$1]) -> "Ball count must be 3 at least." | J162: of:=COM.MICROSOFT.CONCAT("map.put(";[.H162];",";[.I162];");") -> map.put("20431","Ball count must be 3 at least.");
A163: 20432 | B163: balls-must-be-connected. | D163: of:=[.A163] -> 20432 | E163: Míče musí být spojené. | F163: Balls must be connected. | G163: of:=[.A163] -> 20432 | H163: of:=COM.MICROSOFT.CONCAT([.$H$1];[.D163];[.$H$1]) -> "20432" | I163: of:=COM.MICROSOFT.CONCAT([.$H$1];[.F163];[.$H$1]) -> "Balls must be connected." | J163: of:=COM.MICROSOFT.CONCAT("map.put(";[.H163];",";[.I163];");") -> map.put("20432","Balls must be connected.");
A164: 20433 | B164: you-cannot-use-this-shape.-this-shape-the-same-as-line. | D164: of:=[.A164] -> 20433 | E164: Nemůžete použít tento tvar. Tento tvar je stejný jako čára | F164: You cannot use this shape. This shape the same as line. | G164: of:=[.A164] -> 20433 | H164: of:=COM.MICROSOFT.CONCAT([.$H$1];[.D164];[.$H$1]) -> "20433" | I164: of:=COM.MICROSOFT.CONCAT([.$H$1];[.F164];[.$H$1]) -> "You cannot use this shape. This shape the same as line." | J164: of:=COM.MICROSOFT.CONCAT("map.put(";[.H164];",";[.I164];");") -> map.put("20433","You cannot use this shape. This shape the same as line.");
A165: 20434 | B165: you-cannot-use-this-shape.-this-shape-the-same-as-ring. | D165: of:=[.A165] -> 20434 | E165: Nemůžete použít tento tvar. Tento tvar je stejně jako kroužek | F165: You cannot use this shape. This shape the same as ring. | G165: of:=[.A165] -> 20434 | H165: of:=COM.MICROSOFT.CONCAT([.$H$1];[.D165];[.$H$1]) -> "20434" | I165: of:=COM.MICROSOFT.CONCAT([.$H$1];[.F165];[.$H$1]) -> "You cannot use this shape. This shape the same as ring." | J165: of:=COM.MICROSOFT.CONCAT("map.put(";[.H165];",";[.I165];");") -> map.put("20434","You cannot use this shape. This shape the same as ring.");
A166: 20435 | B166: you-cannot-use-this-shape.-this-shape-the-same-as-rectangle. | D166: of:=[.A166] -> 20435 | E166: Nemůžete použít tento tvar. Tento tvar je stejné jako obdélník | F166: You cannot use this shape. This shape the same as rectangle. | G166: of:=[.A166] -> 20435 | H166: of:=COM.MICROSOFT.CONCAT([.$H$1];[.D166];[.$H$1]) -> "20435" | I166: of:=COM.MICROSOFT.CONCAT([.$H$1];[.F166];[.$H$1]) -> "You cannot use this shape. This shape the same as rectangle." | J166: of:=COM.MICROSOFT.CONCAT("map.put(";[.H166];",";[.I166];");") -> map.put("20435","You cannot use this shape. This shape the same as rectangle.");
A167: 20500 | B167: other | D167: of:=[.A167] -> 20500 | E167: Ostatní | F167: Other | G167: of:=[.A167] -> 20500 | H167: of:=COM.MICROSOFT.CONCAT([.$H$1];[.D167];[.$H$1]) -> "20500" | I167: of:=COM.MICROSOFT.CONCAT([.$H$1];[.F167];[.$H$1]) -> "Other" | J167: of:=COM.MICROSOFT.CONCAT("map.put(";[.H167];",";[.I167];");") -> map.put("20500","Other");
A168: 20501 | B168: allow-step-back | D168: of:=[.A168] -> 20501 | E168: Povolit krok zpět | F168: Allow step back | G168: of:=[.A168] -> 20501 | H168: of:=COM.MICROSOFT.CONCAT([.$H$1];[.D168];[.$H$1]) -> "20501" | I168: of:=COM.MICROSOFT.CONCAT([.$H$1];[.F168];[.$H$1]) -> "Allow step back" | J168: of:=COM.MICROSOFT.CONCAT("map.put(";[.H168];",";[.I168];");") -> map.put("20501","Allow step back");
A169: 20502 | B169: free-mode | D169: of:=[.A169] -> 20502 | E169: Volný režim | F169: Free mode | G169: of:=[.A169] -> 20502 | H169: of:=COM.MICROSOFT.CONCAT([.$H$1];[.D169];[.$H$1]) -> "20502" | I169: of:=COM.MICROSOFT.CONCAT([.$H$1];[.F169];[.$H$1]) -> "Free mode" | J169: of:=COM.MICROSOFT.CONCAT("map.put(";[.H169];",";[.I169];");") -> map.put("20502","Free mode");
A170: 20503 | B170: trainer | D170: of:=[.A170] -> 20503 | E170: Trenér | F170: Trainer | G170: of:=[.A170] -> 20503 | H170: of:=COM.MICROSOFT.CONCAT([.$H$1];[.D170];[.$H$1]) -> "20503" | I170: of:=COM.MICROSOFT.CONCAT([.$H$1];[.F170];[.$H$1]) -> "Trainer" | J170: of:=COM.MICROSOFT.CONCAT("map.put(";[.H170];",";[.I170];");") -> map.put("20503","Trainer");
A171: 30001 | B171: game-end.-result: | D171: of:=[.A171] -> 30001 | E171: Konec hry. Výsledek: | F171: Game end. Result: | G171: of:=[.A171] -> 30001 | H171: of:=COM.MICROSOFT.CONCAT([.$H$1];[.D171];[.$H$1]) -> "30001" | I171: of:=COM.MICROSOFT.CONCAT([.$H$1];[.F171];[.$H$1]) -> "Game end. Result:" | J171: of:=COM.MICROSOFT.CONCAT("map.put(";[.H171];",";[.I171];");") -> map.put("30001","Game end. Result:");